{
  "schema_version": 2,
  "run_id": "run-20261026-120000",
  "project_id": "demo",
  "target_model": "seedance-2.5",
  "input_hashes": {
    "script_analysis": "bbbbbbbbbbbbbbbbbbbbbbbbbbbbbbbbbbbbbbbbbbbbbbbbbbbbbbbbbbbbbbbb"
  },
  "scenes": [
    {
      "scene_id": "ep01-sc01",
      "clips": [
        {
          "clip_id": "ep01-sc01-c01",
          "order": 1,
          "scene_id": "ep01-sc01",
          "process_id": "ep01-p01",
          "goal": "林岚把信封交给周宁，周宁接住。",
          "duration_sec": 10,
          "entity_ids": [
            "character-a",
            "character-b",
            "scene-living-room",
            "prop-envelope"
          ],
          "reference_asset_ids": [
            "asset-character-a",
            "asset-character-b",
            "asset-scene-living-room",
            "asset-prop-envelope"
          ],
          "continuity": {
            "previous_clip_id": null,
            "enter_state": "信封在林岚手中。",
            "exit_state": "信封在周宁手中。"
          },
          "split_reason": "none",
          "shots": [
            {
              "shot_id": "ep01-sc01-c01-s01",
              "order": 1,
              "start_sec": 0,
              "end_sec": 2,
              "shot_size": "中景",
              "camera_angle": "平视",
              "camera_movement": "固定",
              "transition": "切",
              "purpose": "交代两人和信封的初始位置。",
              "source_action_unit_ids": ["ep01-sc01-a01"],
              "source_emotion_unit_ids": ["ep01-sc01-e01"],
              "continuity": {
                "enter_state": "信封在林岚手中。",
                "exit_state": "林岚抬手递出信封。"
              }
            },
            {
              "shot_id": "ep01-sc01-c01-s02",
              "order": 2,
              "start_sec": 2,
              "end_sec": 5,
              "shot_size": "特写",
              "camera_angle": "俯视",
              "camera_movement": "跟焦",
              "transition": "切",
              "purpose": "强调信封离手和交接动作。",
              "source_action_unit_ids": ["ep01-sc01-a01"],
              "source_emotion_unit_ids": [],
              "continuity": {
                "enter_state": "林岚抬手递出信封。",
                "exit_state": "周宁的手指触到信封。"
              }
            },
            {
              "shot_id": "ep01-sc01-c01-s03",
              "order": 3,
              "start_sec": 5,
              "end_sec": 8,
              "shot_size": "近景",
              "camera_angle": "反打",
              "camera_movement": "推近",
              "transition": "切",
              "purpose": "表现周宁接住信封后的警惕。",
              "source_action_unit_ids": ["ep01-sc01-a01"],
              "source_emotion_unit_ids": ["ep01-sc01-e01"],
              "continuity": {
                "enter_state": "周宁的手指触到信封。",
                "exit_state": "周宁握住信封。"
              }
            },
            {
              "shot_id": "ep01-sc01-c01-s04",
              "order": 4,
              "start_sec": 8,
              "end_sec": 10,
              "shot_size": "中近景",
              "camera_angle": "双人镜头",
              "camera_movement": "固定",
              "transition": "切",
              "purpose": "落在交接完成和两人的对峙状态。",
              "source_action_unit_ids": ["ep01-sc01-a01"],
              "source_emotion_unit_ids": ["ep01-sc01-e01"],
              "continuity": {
                "enter_state": "周宁握住信封。",
                "exit_state": "信封在周宁手中。"
              }
            }
          ],
          "dialogue": [
            {
              "dialogue_segment_id": "ep01-sc01-d01-seg01",
              "dialogue_unit_id": "ep01-sc01-d01",
              "speaker_id": "character-a",
              "start_offset": 0,
              "end_offset": 3,
              "start_sec": 0.5,
              "end_sec": 2.5
            }
          ],
          "audio": {
            "ambience": [
              {
                "cue_id": "ep01-sc01-c01-amb01",
                "text": "客厅环境声持续。",
                "start_sec": 0,
                "end_sec": 10,
                "source_refs": [{ "kind": "scene", "id": "ep01-sc01" }]
              }
            ],
            "sfx": [
              {
                "cue_id": "ep01-sc01-c01-sfx01",
                "text": "信封交接时纸张轻响。",
                "start_sec": 5.2,
                "end_sec": 5.7,
                "source_refs": [{ "kind": "unit", "id": "ep01-sc01-a01" }]
              }
            ],
            "music": []
          }
        }
      ]
    },
    {
      "scene_id": "ep01-sc02",
      "clips": [
        {
          "clip_id": "ep01-sc02-c01",
          "order": 1,
          "scene_id": "ep01-sc02",
          "process_id": "ep01-p02",
          "goal": "周宁从信封中取出项链并质问，林岚沉默。",
          "duration_sec": 6,
          "entity_ids": [
            "character-a",
            "character-b",
            "scene-living-room",
            "prop-envelope",
            "prop-necklace"
          ],
          "reference_asset_ids": [
            "asset-character-a",
            "asset-character-b",
            "asset-scene-living-room",
            "asset-prop-envelope",
            "asset-prop-necklace"
          ],
          "continuity": {
            "previous_clip_id": null,
            "enter_state": "信封在周宁手中，项链仍在信封内。",
            "exit_state": "项链在周宁手中，林岚保持沉默。"
          },
          "split_reason": "none",
          "shots": [
            {
              "shot_id": "ep01-sc02-c01-s01",
              "order": 1,
              "start_sec": 0,
              "end_sec": 3,
              "shot_size": "特写",
              "camera_angle": "俯视",
              "camera_movement": "跟焦",
              "transition": "切",
              "purpose": "展示周宁打开信封并取出项链。",
              "source_action_unit_ids": ["ep01-sc02-a01"],
              "source_emotion_unit_ids": [],
              "continuity": {
                "enter_state": "信封在周宁手中，尚未打开。",
                "exit_state": "项链被取出。"
              }
            },
            {
              "shot_id": "ep01-sc02-c01-s02",
              "order": 2,
              "start_sec": 3,
              "end_sec": 6,
              "shot_size": "近景",
              "camera_angle": "平视",
              "camera_movement": "固定",
              "transition": "切",
              "purpose": "表现周宁的震惊和林岚的沉默。",
              "source_action_unit_ids": ["ep01-sc02-a01"],
              "source_emotion_unit_ids": ["ep01-sc02-e01"],
              "continuity": {
                "enter_state": "项链被取出。",
                "exit_state": "项链在周宁手中，林岚保持沉默。"
              }
            }
          ],
          "dialogue": [
            {
              "dialogue_segment_id": "ep01-sc02-d01-seg01",
              "dialogue_unit_id": "ep01-sc02-d01",
              "speaker_id": "character-b",
              "start_offset": 0,
              "end_offset": 6,
              "start_sec": 3.4,
              "end_sec": 5.6
            }
          ],
          "audio": {
            "ambience": [
              {
                "cue_id": "ep01-sc02-c01-amb01",
                "text": "客厅环境声持续。",
                "start_sec": 0,
                "end_sec": 6,
                "source_refs": [{ "kind": "scene", "id": "ep01-sc02" }]
              }
            ],
            "sfx": [],
            "music": []
          }
        }
      ]
    }
  ],
  "knowledge_refs": [],
  "generated_at": "2026-10-26T12:01:00+08:00"
}
